{
    "$schema": "https://json-schema.org/draft/2020-12/schema",
    "$id": "https://nfh-trust-labs.github.io/vc-schemas/energy-credentials/utility-customer-vc/schema.json",
    "title": "Utility Customer Credential Schema",
    "description": "JSON Schema for a barebones identity credential for privacy-preserving customer identification issued by electricity distribution utilities.",
    "type": "object",
    "required": [
        "@context",
        "id",
        "type",
        "issuer",
        "issuanceDate",
        "credentialSubject"
    ],
    "properties": {
        "@context": {
            "type": "array",
            "items": {
                "type": "string"
            },
            "contains": {
                "const": "https://www.w3.org/2018/credentials/v1"
            },
            "minItems": 2
        },
        "id": {
            "type": "string",
            "format": "uri",
            "pattern": "^urn:uuid:[0-9a-f]{8}-[0-9a-f]{4}-[0-9a-f]{4}-[0-9a-f]{4}-[0-9a-f]{12}$",
            "description": "Unique identifier for the credential in URN UUID format"
        },
        "type": {
            "type": "array",
            "items": {
                "type": "string"
            },
            "contains": {
                "const": "UtilityCustomerCredential"
            },
            "minItems": 2
        },
        "issuer": {
            "type": "object",
            "required": ["id", "name", "licenseNumber"],
            "properties": {
                "id": {
                    "type": "string",
                    "format": "uri",
                    "description": "DID of the issuing distribution utility"
                },
                "name": {
                    "type": "string",
                    "minLength": 1,
                    "description": "Name of the distribution utility"
                },
                "licenseNumber": {
                    "type": "string",
                    "minLength": 1,
                    "description": "Regulatory license number issued by the local energy regulator"
                }
            }
        },
        "issuanceDate": {
            "type": "string",
            "format": "date-time",
            "description": "Date and time when the credential was issued"
        },
        "expirationDate": {
            "type": "string",
            "format": "date-time",
            "description": "Optional expiration date of the credential"
        },
        "credentialSubject": {
            "type": "object",
            "required": [
                "id",
                "consumerNumber",
                "fullName",
                "installationAddress",
                "meterNumber",
                "serviceConnectionDate"
            ],
            "properties": {
                "id": {
                    "type": "string",
                    "format": "uri",
                    "description": "DID of the customer/credential subject"
                },
                "consumerNumber": {
                    "type": "string",
                    "minLength": 1,
                    "description": "Full consumer account number assigned by the utility"
                },
                "maskedIdNumber": {
                    "type": "string",
                    "minLength": 1,
                    "description": "Optional masked government ID (e.g., driving license, national ID) for additional verification (e.g., 'XXXX-XXXX-1234')"
                },
                "fullName": {
                    "type": "string",
                    "minLength": 1,
                    "maxLength": 200,
                    "description": "Full name of the customer as per ID proof"
                },
                "installationAddress": {
                    "type": "object",
                    "required": ["fullAddress", "postalCode", "country"],
                    "properties": {
                        "fullAddress": {
                            "type": "string",
                            "minLength": 1,
                            "maxLength": 500,
                            "description": "Complete street address of the installation"
                        },
                        "city": {
                            "type": "string",
                            "minLength": 1,
                            "description": "City name"
                        },
                        "district": {
                            "type": "string",
                            "minLength": 1,
                            "description": "District or county name"
                        },
                        "stateProvince": {
                            "type": "string",
                            "minLength": 1,
                            "description": "State, province, or region name"
                        },
                        "postalCode": {
                            "type": "string",
                            "minLength": 1,
                            "description": "Postal or ZIP code (format varies by country)"
                        },
                        "country": {
                            "type": "string",
                            "pattern": "^[A-Z]{2}$",
                            "description": "ISO 3166-1 alpha-2 country code"
                        }
                    }
                },
                "meterNumber": {
                    "type": "string",
                    "minLength": 1,
                    "maxLength": 50,
                    "description": "Unique meter serial number"
                },
                "serviceConnectionDate": {
                    "type": "string",
                    "format": "date",
                    "description": "Date when the connection was activated"
                }
            }
        },
        "proof": {
            "type": "object",
            "required": ["type", "created", "verificationMethod", "proofPurpose", "proofValue"],
            "properties": {
                "type": {
                    "type": "string",
                    "description": "Cryptographic signature type (e.g., Ed25519Signature2020)"
                },
                "created": {
                    "type": "string",
                    "format": "date-time",
                    "description": "Timestamp when the proof was created"
                },
                "verificationMethod": {
                    "type": "string",
                    "format": "uri",
                    "description": "URI of the verification method/public key"
                },
                "proofPurpose": {
                    "type": "string",
                    "enum": ["assertionMethod", "authentication"],
                    "description": "Purpose of the proof"
                },
                "proofValue": {
                    "type": "string",
                    "minLength": 1,
                    "description": "The cryptographic signature value"
                }
            }
        }
    }
}
