{
  "@context": [
    "https://www.w3.org/2018/credentials/v1",
    "https://schema.org/",
    "https://nfh-trust-labs.github.io/vc-schemas/energy-credentials/utility-customer-vc/context.jsonld"
  ],
  "id": "urn:uuid:a1b2c3d4-5678-90ab-cdef-123456789012",
  "type": ["VerifiableCredential", "UtilityCustomerCredential"],
  "issuer": {
    "id": "did:web:example-utility.com",
    "name": "Example Energy Utility",
    "licenseNumber": "REG-2025-00001"
  },
  "issuanceDate": "2025-01-13T10:30:00Z",
  "credentialSubject": {
    "id": "did:example:consumer:abc123",
    "consumerNumber": "UTIL-2025-001234567",
    "maskedIdNumber": "XXXX-XXXX-1234",
    "fullName": "Jane Doe",
    "installationAddress": {
      "fullAddress": "123 Energy Street, Unit 4",
      "city": "Metro City",
      "district": "Metro District",
      "stateProvince": "Example State",
      "postalCode": "12345",
      "country": "US"
    },
    "meterNumber": "MET2025789456123",
    "serviceConnectionDate": "2025-01-10"
  },
  "proof": {
    "type": "Ed25519Signature2020",
    "created": "2025-01-13T10:30:00Z",
    "verificationMethod": "did:web:example-utility.com#key-1",
    "proofPurpose": "assertionMethod",
    "proofValue": "z58DAdFfa9SkqZMVPxAQpic7ndTaXoT..."
  }
}
